A1: egedk | B1: 埃及 | C1: 42922. | D1: 長榮 | E1: EL DEKHEILA | G1: SAN ANTONIO | I1: etd | J1: etc | K1: Transit Time
A2: eavlg | B2: 西班牙 | C2: 42948. | D2: 快桅 | E2: VILANOVA | G2: wanhai | I2: SAN ANTONIO | J2: kao
A3: esvlc | B3: 西班牙 | C3: 42955. | D3: 快桅 | E3: VALENCIA | G3: COSCO PRINCE RUPERT | H3: W050 | I3: 11/27 - | J3: 12/26 - | K3: =DATEDIF(MID(I3,1,5),MID(J3,1,5),"D") -> 29
A4: egdam | B4: 埃及 | C4: 43025. | D4: nyk | E4: DAMIETTA | G4: MEDITERRANEAN BRIDGE | H4: W002 | I4: 12/04 - | J4: 1/02 - | K4: 29
A5: clsai | B5: 智利 | C5: 43109. | D5: 快桅 | E5: SAN ANTONIO | G5: SEAMAX NEW HAVEN | H5: W007 | I5: 12/11 - | J5: 1/09 - | K5: 29
G6: ITAL CONTESSA | H6: W084 | I6: 12/18 - | J6: 1/16 - | K6: 29
A7: intut | B7: India | E7: Tuticorin | G7: EVER LOVELY | H7: W020 | I7: 12/25 - | J7: 1/23 - | K7: 29
A8: JNPT | B8: India | E8: NHAVA SHEVA | G8: NORTHERN JUVENILE | H8: W009 | I8: 1/01 - | J8: 1/30 - | K8: =DATEDIF(MID(I8,1,5),MID(J8,1,5),"D") -> 29
A9: inmaa | B9: india | E9: Chennai | G9: XIN DA YANG ZHOU | H9: W038 | I9: 1/08 - | J9: 2/06 - | K9: =DATEDIF(MID(I9,1,5),MID(J9,1,5),"D") -> 29
G10: EVER ENVOY | H10: W147 | I10: 1/15 - | J10: 2/13 - | K10: =DATEDIF(MID(I10,1,5),MID(J10,1,5),"D") -> 29
A11: EGALY | B11: EGYPT | E11: EL DEKHELA(ALEXANDRIA) | G11: YM UNANIMITY | H11: W040 | I11: 1/22 - | J11: 2/20 - | K11: =DATEDIF(MID(I11,1,5),MID(J11,1,5),"D") -> 29
E12: San Pedro | G12: apl
E13: Buenos Aires | G13: SEAMAX NEW HAVEN | H13: 0LS1MW1PL | I13: 43433. | J13: 43109. | K13: 28
G14: ITAL CONTESSA | H14: 0LS1OW1PL | I14: 43452. | J14: 43116. | K14: 28
E15: Iquique | G15: 快桅
B16: india | G16: SVENDBORG MAERSK | H16: 846W | I16: 43437. | J16: 43113. | K16: 41
F17: 漢堡南美 | G17: HamburgSud | I17: 43437. | J17: 43457. | K17: 20
G18: Hapag-Lloyd | I18: 43433. | J18: 43107. | K18: 39
F19: cma | G19: CMA-CGM | I19: 43441. | J19: 43109. | K19: 28
F20: 陽明 | G20: Yang Ming | I20: 43438. | J20: 43102. | K20: 29
F21: 陽明 | G21: Yang Ming | I21: 43438. | J21: 43465. | K21: =DATEDIF(MID(I21,1,5),MID(J21,1,5),"D") -> 27
G23: EL DEKHEILA
G24: OOCL | I24: 43434. | J24: 43459. | K24: 24
F25: 漢堡南美 | G25: HBS | I25: 43436. | J25: 43460. | K25: 24
F26: oocl | G26: EM2-MAERSK SARNIA | H26: 004E | I26: 43427. | J26: 43459. | K26: 24
F27: 長榮 | G27: FEM-EVER ULYSSES-1349 | H27: 116E | I27: 43435. | J27: 43101. | K27: 31
G29: DAMIETTA
F30: mol | G30: MOL CHARISMA | H30: 203E | I30: 43434. | J30: 43457. | K30: 23
A31: 7-11月 | F31: msc | G31: MSC SAVONA | H31: 846E | I31: 43439. | J31: 43460. | K31: 24
A32: 埃及.西班牙
A33: 1-3月 | G33: VALENCIA
A34: 阿根廷.智利 | F34: apl | G34: TAMPA TRIUMPH | H34: 02M1WE1PL | I34: 43435. | J34: 43464. | K34: 29
F35: oocl | G35: TAMPA TRIUMPH | H35: 0358-009E | I35: 43437. | J35: 43464. | K35: =DATEDIF(MID(I35,1,5),MID(J35,1,5),"D") -> 27
G37: VILANOVA
F38: oocl | G38: CMA CGM LEO | H38: 0ME1YE1MA | I38: 43435. | J38: 43113. | K38: 42
F39: oocl | G39: CMA CGM CASSIOPEIA | H39: 0ME22E1MA | I39: 43448. | J39: 43127. | K39: 43