A1: egedk | B1: 埃及 | C1: 42922. | D1: 長榮 | E1: EL DEKHEILA | G1: SAN ANTONIO | I1: etd | J1: etc | K1: Transit Time
A2: egedk | B2: 埃及 | C2: 42927. | D2: 陽明 | E2: EL DEKHEILA | G2: wanhai | I2: SAN ANTONIO | J2: kao
A3: eavlg | B3: 西班牙 | C3: 42948. | D3: 快桅 | E3: VILANOVA | G3: COSCO PRINCE RUPERT | H3: W050 | I3: 11/27 - | J3: 12/26 - | K3: =DATEDIF(MID(I3,1,5),MID(J3,1,5),"D") -> 29
A4: esvlc | B4: 西班牙 | C4: 42955. | D4: 快桅 | E4: VALENCIA | G4: MEDITERRANEAN BRIDGE | H4: W002 | I4: 12/04 - | J4: 1/02 - | K4: =DATEDIF(MID(I4,1,5),MID(J4,1,5),"D") -> -336
A5: egedk | B5: 埃及 | C5: 42969. | D5: oocl | E5: EL DEKHEILA | G5: SEAMAX NEW HAVEN | H5: W007 | I5: 12/11 - | J5: 1/09 - | K5: =DATEDIF(MID(I5,1,5),MID(J5,1,5),"D") -> -336
A6: egedk | B6: 埃及 | C6: 42975. | D6: 快桅 | E6: EL DEKHEILA | G6: ITAL CONTESSA | H6: W084 | I6: 12/18 - | J6: 1/16 - | K6: =DATEDIF(MID(I6,1,5),MID(J6,1,5),"D") -> -336
A7: egedk | B7: 埃及 | C7: 42982. | D7: 長榮 | E7: EL DEKHEILA | G7: EVER LOVELY | H7: W020 | I7: 12/25 - | J7: 1/23 - | K7: =DATEDIF(MID(I7,1,5),MID(J7,1,5),"D") -> -336
A8: egedk | B8: 埃及 | C8: 42992. | E8: EL DEKHEILA | G8: NORTHERN JUVENILE | H8: W009 | I8: 1/01 - | J8: 1/30 - | K8: =DATEDIF(MID(I8,1,5),MID(J8,1,5),"D") -> 29
A9: esvlc | B9: 西班牙 | C9: 42998. | D9: nyk | E9: VALENCIA | G9: XIN DA YANG ZHOU | H9: W038 | I9: 1/08 - | J9: 2/06 - | K9: =DATEDIF(MID(I9,1,5),MID(J9,1,5),"D") -> 29
A10: esvlc | B10: 西班牙 | C10: 42999. | D10: 百利 | E10: VALENCIA | G10: EVER ENVOY | H10: W147 | I10: 1/15 - | J10: 2/13 - | K10: =DATEDIF(MID(I10,1,5),MID(J10,1,5),"D") -> 29
A11: esvlc | B11: 西班牙 | C11: 43005. | D11: 漢堡 | E11: VALENCIA | G11: YM UNANIMITY | H11: W040 | I11: 1/22 - | J11: 2/20 - | K11: =DATEDIF(MID(I11,1,5),MID(J11,1,5),"D") -> 29
A12: egedk | B12: 埃及 | C12: 43024. | D12: 漢堡 | E12: EL DEKHEILA | G12: apl
A13: egdam | B13: 埃及 | C13: 43025. | D13: nyk | E13: DAMIETTA | G13: SEAMAX NEW HAVEN | H13: 0LS1MW1PL | I13: 43433. | J13: 43109. | K13: 28
A14: egdam | B14: 埃及 | C14: 43032. | D14: 快桅 | E14: DAMIETTA | G14: ITAL CONTESSA | H14: 0LS1OW1PL | I14: 43452. | J14: 43116. | K14: 28
A15: clsai | B15: 智利 | C15: 43109. | D15: 快桅 | E15: SAN ANTONIO | G15: 快桅
A16: clsai | B16: 智利 | C16: 43116. | D16: 快桅 | E16: SAN ANTONIO | G16: SVENDBORG MAERSK | H16: 846W | I16: 43437. | J16: 43113. | K16: 41
A17: clsai | B17: 智利 | C17: 43125. | D17: msc | E17: SAN ANTONIO
A18: clsai | B18: 智利 | C18: 43152. | D18: 快桅 | E18: SAN ANTONIO | G18: Hapag-Lloyd | I18: 43433. | J18: 43107. | K18: 39
A19: clsai | B19: 智利 | C19: 43157. | D19: 快桅 | E19: SAN ANTONIO | G19: CMA-CGM | I19: 43441. | J19: 43109. | K19: 28
A20: clsai | B20: 智利 | C20: 43171. | D20: 快桅 | E20: SAN ANTONIO | G20: Yang Ming | I20: 43438. | J20: 43102. | K20: 29
A21: clsai | B21: 智利 | C21: 43172. | D21: 快桅 | E21: SAN ANTONIO | G21: Yang Ming | I21: 43438. | J21: 43465. | K21: =DATEDIF(MID(I21,1,5),MID(J21,1,5),"D") -> 27
A22: clsai | B22: 智利 | C22: 43185. | D22: 快桅 | E22: SAN ANTONIO
A23: egdam | B23: 埃及 | C23: 43284. | D23: 快桅 | E23: DAMIETTA | G23: EL DEKHEILA
A24: egdam | B24: 埃及 | C24: 43294. | D24: 陽明 | E24: DAMIETTA | G24: OOCL | I24: 43434. | J24: 43459. | K24: 24
A25: egdam | B25: 埃及 | C25: 43319. | D25: 赫伯羅特 | E25: DAMIETTA | G25: HBS | I25: 43436. | J25: 43460. | K25: 24
A26: egdam | B26: 埃及 | C26: 43326. | D26: 陽明 | E26: DAMIETTA | F26: oocl | G26: EM2-MAERSK SARNIA | H26: 004E | I26: 43427. | J26: 43459. | K26: 24
A27: egedk | B27: 埃及 | C27: 43368. | D27: 長榮 | E27: EL DEKHEILA | F27: 長榮 | G27: FEM-EVER ULYSSES-1349 | H27: 116E | I27: 43435. | J27: 43101. | K27: 31
A28: egedk | B28: 埃及 | C28: 43370. | D28: 長榮 | E28: EL DEKHEILA
A29: esvlc | B29: 西班牙 | C29: 43423. | D29: 中海 | E29: VALENCIA | G29: DAMIETTA
G30: MOL CHARISMA | H30: 203E | I30: 43434. | J30: 43457. | K30: 23
A31: 7-11月 | G31: MSC SAVONA | H31: 846E | I31: 43439. | J31: 43460. | K31: 24
A32: 埃及.西班牙
A33: 1-3月 | G33: VALENCIA
A34: 阿根廷.智利 | F34: apl | G34: TAMPA TRIUMPH | H34: 02M1WE1PL | I34: 43435. | J34: 43464. | K34: 29
F35: oocl | G35: TAMPA TRIUMPH | H35: 0358-009E | I35: 43437. | J35: 43464. | K35: =DATEDIF(MID(I35,1,5),MID(J35,1,5),"D") -> 27
G37: VILANOVA
F38: oocl | G38: CMA CGM LEO | H38: 0ME1YE1MA | I38: 43435. | J38: 43113. | K38: 42
F39: oocl | G39: CMA CGM CASSIOPEIA | H39: 0ME22E1MA | I39: 43448. | J39: 43127. | K39: 43